{"activeBlocker":null,"activeOwners":[{"ownerId":"worker-alpha-1","registeredCloneDigest":"sha256:30e5b0cbd8081d6fe89245f16cfa5da93afa4d07c8d3904d18c83a8638bf15f9","storyId":"alpha","workerStartSha":"aaaaaaaaaaaaaaaaaaaaaaaaaaaaaaaaaaaaaaaa","writeScopes":["src/alpha"]}],"baseSha":"aaaaaaaaaaaaaaaaaaaaaaaaaaaaaaaaaaaaaaaa","blockerHistory":[],"currentIntegrationSha":"aaaaaaaaaaaaaaaaaaaaaaaaaaaaaaaaaaaaaaaa","initialIntegrationSha":"aaaaaaaaaaaaaaaaaaaaaaaaaaaaaaaaaaaaaaaa","integrationBranch":"cb/rolling/integration","integrationQueue":[],"lastEventDigest":"sha256:8888888888888888888888888888888888888888888888888888888888888888","lastEventSequence":1,"lastVerifiedIntegrationSha":"aaaaaaaaaaaaaaaaaaaaaaaaaaaaaaaaaaaaaaaa","planDigest":"sha256:99ac77d55d3deb45997283efbdf5749a94abc058814005b46fd32e048fb92cbd","previousState":"planned","runId":"cb-rolling-1111111111111111","schemaVersion":"compass-builder.pipeline-state.v2","state":"running","stories":[{"attempt":1,"blockedFromLifecycle":null,"branch":"cb/cb-rolling-1111111111111111/alpha","gateEvidenceDigests":[],"importEvidenceDigest":null,"integrationOrdinal":1,"integrationSha":null,"lifecycle":"running","mergeIntentDigest":null,"postCheckEvidenceDigest":null,"registeredCloneDigest":"sha256:30e5b0cbd8081d6fe89245f16cfa5da93afa4d07c8d3904d18c83a8638bf15f9","storyId":"alpha","verificationEvidenceDigest":null,"workerReceiptDigest":null,"workerStartSha":"aaaaaaaaaaaaaaaaaaaaaaaaaaaaaaaaaaaaaaaa"},{"attempt":0,"blockedFromLifecycle":null,"branch":"cb/cb-rolling-1111111111111111/beta","gateEvidenceDigests":[],"importEvidenceDigest":null,"integrationOrdinal":2,"integrationSha":null,"lifecycle":"never-launched","mergeIntentDigest":null,"postCheckEvidenceDigest":null,"registeredCloneDigest":null,"storyId":"beta","verificationEvidenceDigest":null,"workerReceiptDigest":null,"workerStartSha":null}]}
